Journal Title,Rating,Publisher,ISSN,ISSN Online,FoR,Year Inception
4OR,B,Springer Nature,1619-4500,1614-2411,3599,2003
AACE International Transactions,B,AACE International,1528-7106,1528-7106,3599,1967
Abacus,B,Wiley-Blackwell Publishing,0001-3072,1467-6281,3501,1965
Academia Economic Papers,B,"Institute of Economics, Academia Sinica",1018-161X,,3801,1973
Academy of Management Annals,B,Academy of Management,1941-6520,1941-6067,3507,2008
Academy of Management Discoveries,B,Academy of Management,2168-1007,,3507,2015
Academy of Management Journal,B,Academy of Management,0001-4273,1948-0989,3507,1958
Academy of Management Learning and Education,B,Academy of Management,1537-260X,1944-9585,3507,2002
Academy of Management Perspectives,B,Academy of Management,1558-9080,1943-4529,3507,1987
Academy of Management Review,B,Academy of Management,0363-7425,1930-3807,3507,1976
Academy of Marketing Studies Journal,B,Allied Business Academies,1095-6298,1528-2678,3506,1980
Accident Analysis and Prevention,B,Elsevier,0001-4575,1879-2057,3509,1969
Accountancy Business and the Public Interest,B,Association for Accountancy & Business Affairs,1745-7718,,3501,2002
Accounting Accountability and Performance,B,Griffith University,1445-954X,,3501,1995
Accounting and Business Research,B,Taylor & Francis Online,0001-4788,2159-4260,3501,1970
Accounting and Finance,B,Wiley-Blackwell Publishing,0810-5391,1467-629X,3501,1961
Accounting and Taxation,B,Institute for Business and Finance Research,1944-592X,,3501,2007
Accounting and the Public Interest,B,American Accounting Association,1530-9320,,3501,2001
Accounting Auditing and Accountability Journal,B,Emerald Group Publishing Limited,0951-3574,1758-4205,3501,1988
Accounting Education,B,Taylor & Francis Online,0963-9284,1468-4489,3501,1992
Accounting Educators Journal,B,Academy of Accounting Educators Inc.,1041-0392,,3501,1988
Accounting Forum,B,Taylor & Francis Online,0155-9982,1467-6303,3501,2004
Accounting Historians Journal,B,American Accounting Association,0148-4184,,3501,1977
Accounting History,B,Sage Publications,1032-3732,1749-3374,3501,1989
Accounting History Review,B,Taylor & Francis Online,2155-2851,2155-286X,3501,2011
Accounting Horizons,B,American Accounting Association,0888-7993,1558-7975,3501,1987
Accounting in Europe,B,Taylor & Francis Online,1744-9480,1744-9499,3501,2004
Accounting Perspectives,B,Wiley-Blackwell Publishing,1911-382X,1911-3838,3501,2002
Accounting Research Journal,B,Emerald Group Publishing Limited,1030-9616,,3501,1986
"Accounting, Economics and Law – A Convivium",B,De Gruyter,2194-6051,2152-2820,3501,2011
"Accounting, Finance and Governance Review",B,Irish Accounting and Finance Association,0791-9638,,3501,1994
"Accounting, Organizations and Society",B,Elsevier,0361-3682,1873-6289,3501,1976
ACM Transactions on Computer-Human Interaction,B,Association for Computing Machinery,1073-0516,1557-7325,4609,1994
ACM Transactions on Computing Education,B,The Association for Computing Machinery,1531-4278,1531-4278,4609,2009
ACM Transactions on Information Systems,B,Association for Computing Machinery,1046-8188,1558-2868,4609,1983
ACM Transactions on Modeling and Computer Simulation,B,Association for Computing Machinery,1049-3301,1558-1195,3599,1991
Acta Oeconomica,B,Akademiai Kiado,0001-6373,1588-2659,3899,1951
Acta Psychologica,B,Elsevier,0001-6918,1873-6297,3507,1936
Acta Turistica,B,"University of Zagreb, Faculty of Economics and Business",0353-4316,1848-6061,3508,1989
Acta Universitatis Bohemiae Meridionalis,B,University of South Bohemia Faculty of Economics,1212-3285,2336-4297,3801,1971
Action Learning and Action Research Journal,B,ALARA Association Inc.,1326-964X,1326-964X,3507,1996
Action Learning Research and Practice,B,Taylor and Francis Online,1476-7333,1476-7341,3507,2004
Active Learning in Higher Education,B,Sage Publications,1469-7874,1741-2625,3505,2000
Actuarial Research Clearinghouse,B,SOA Education and Research Section,0732-5428,,3502,2004
Adelaide Law Review,B,University of Adelaide,0065-1915,,4801,1960
Administration and Society,B,Sage Publications,0095-3997,1552-3039,3507,1975
Administrative Science Quarterly,B,Sage Publications,0001-8392,1930-3815,3507,1956
Administrative Theory and Praxis,B,Taylor & Francis Online,1084-1806,1949-0461,3507,1979
Advances and Applications in Statistics,B,Pushpa Publishing House,0972-3617,,4905,2001
Advances in Accounting,B,Elsevier,0882-6110,1046-5715,3501,1984
Advances in Accounting Behavioral Research,B,Emerald Group Publishing,1475-1488,,3501,1998
Advances in Accounting Education: teaching and curriculum innovations,B,Emerald Group Publishing,1085-4622,,3501,1996
Advances in Applied Probability,B,Applied Probability Trust,0001-8678,1475-6064,4905,1964
Advances in Consumer Research,B,Association for Consumer Research,0098-9258,,3506,1974
Advances in Developing Human Resources,B,Sage Publications,1523-4223,1552-3055,3505,1999
Advances in Environmental Accounting and Management,B,Emerald Group Publishing,1479-3598,,3501,2000
Advances in Experimental Social Psychology,B,Elsevier,0065-2601,1557-8410,3507,1964
Advances in Hospitality and Leisure,B,Emerald Group Publishing,1745-3542,,3504,2005
Advances in International Management,B,Emerald Group Publishing,1571-5027,,3507,1988
Advances in International Marketing,B,Emerald Group Publishing,1474-7979,,3506,1986
Advances in Management Accounting,B,Emerald Group Publishing,1474-7871,,3501,1990
Advances in Public Interest Accounting,B,Emerald Group Publishing,1041-7060,,3501,1986
Advances in Strategic Management,B,Emerald Group Publishing,0742-3322,,3507,1983
Advances in Taxation,B,Emerald Group Publishing,1058-7497,,4801,1987
Advertising & Society Review,B,Johns Hopkins University Press,2475-1790,1534-7311,3506,2000
Afaq Iqtisadiyyah,B,Federation of UAE Chambers of Commerce and Industry: Centre for Research and Authentication,1024-266X,,3801,1980
Africa Development/Afrique et Developpement,B,Council for the Development of Economic and Social Research in Africa,0850-3907,,3899,1976
African Development Review,B,Wiley-Blackwell Publishing,1017-6772,1467-8268,3899,1989
African Economic History,B,University of Wisconsin Press,0145-2258,2163-9108,3801,1974
"African Journal of Accounting, Auditing and Finance",B,Inderscience Enterprises Ltd.,2046-8083,2046-8091,3501,2012
"African Journal of Accounting, Economics, Finance and Banking Research",B,Global Business Investments and Publications,1933-3404,1933-3463,3502,2007
African Journal of Agricultural and Resource Economics,B,African Association of Agricultural Economists,1993-3738,2521-9871,3801,2006
African Journal of Business and Economic Research,B,Adonis and Abbey Publishers Ltd,1750-4554,1750-4562,3801,2006
African Journal of Economic and Management Studies,B,Emerald Group Publishing,2040-0705,2040-0713,3507,2010
African Journal of Economic and Sustainable Development,B,Inderscience Enterprises Ltd.,2046-4770,2046-4789,3801,2012
African Review of Economics and Finance,B,Wits University Press,2042-1478,2410-4906,3801,2009
Afrika Spectrum,B,Deutsches Institut für Afrika-Forschung,0002-0397,1868-6869,3801,1966
Afro-Asian Journal of Finance and Accounting,B,Inderscience Enterprises Ltd.,1751-6447,1751-6455,3502,2008
AgBioForum,B,Illinois Missouri Biotechnology Alliance,1522-936X,,3801,1998
Agenda: a journal of policy analysis and reform,B,Australian National University,1322-1833,1447-4735,3801,1994
Agribusiness: An international journal,B,Wiley-Blackwell Publishing,0742-4477,1520-6297,3801,1984
Agricultural and Resource Economics Review,B,Cambridge University Press,1068-2805,2372-2614,3801,1972
Agricultural Economics,B,Wiley-Blackwell Publishing,0169-5150,1574-0862,3801,1928
Agricultural Economics and Rural Development,B,Institute of Agricultural Economics,,,3899,2004
Agricultural Economics Research Review,B,Agricultural Economics Research Association,0971-3441,0974-0279,3899,1988
Agricultural Economics Review,B,Greek Association of Agricultural Economists,1109-2580,,3899,2000
Agricultural Finance Review,B,Emerald Group Publishing,0002-1466,2041-6326,3502,1931
Agriculture and Human Values,B,Springer International Publishing,0889-048X,1572-8366,3801,1984
Air and Space Law,B,Kluwer Law International,0927-3379,1875-8339,4801,1974
AIS Educator Journal,B,Allen Press Inc.,1935-8156,,3501,2006
AIS Transactions on Human-Computer Interaction,B,Association for Information Systems,1944-3900,,4609,2009
Akron Tax Journal,B,University of Akron,1044-4130,,4801,1983
Alberta Law Review,B,University of Alberta,0002-4821,,4801,1955
Algorithmic Finance,B,IOS Press,2158-5571,2157-6203,3502,2011
ALI - ABA Business Law Course Materials Journal,B,American Law Institute,1536-4445,,4801,1976
Aligarh Journal of Statistics,B,Aligarh Muslim University,0971-0388,,4905,1981
Alternative Law Journal,B,Sage Publications,1037-969X,2398-9084,4801,1975
"Alternatives: global, local, political",B,Sage Publications,0304-3754,2163-3150,3507,1974
American Bankruptcy Institute Law Review,B,St. John's University School of Law,1068-0861,,4801,1993
American Bankruptcy Law Journal,B,The National Conference of Bankruptcy Judges,0027-9048,,4801,1971
American Behavioral Scientist,B,Sage Publications,0002-7642,1552-3381,3507,1957
American Business Law Journal,B,Wiley-Blackwell Publishing,0002-7766,1744-1714,4801,1963
American Business Review,B,University of New Haven,0743-2348,0743-2348,3507,1983
American Economic Journal: Applied Economics,B,American Economic Association,1945-7782,1945-7790,3801,2009
American Economic Journal: Economic Policy,B,American Economic Association,1945-7731,1945-774X,3801,2009
American Economic Journal: Macroeconomics,B,American Economic Association,1945-7707,1945-7715,3801,2009
American Economic Journal: Microeconomics,B,American Economic Association,1945-7669,1945-7685,3801,2009
American Economic Review: Insights,B,American Economic Association,2640-205X,2640-2068,3801,2019
American Economist,B,Sage Publications,0569-4345,2328-1235,3801,1960
American Journal of Agricultural Economics,B,Oxford University Press,0002-9092,1467-8276,3801,1919
American Journal of Comparative Law,B,Oxford University Press,0002-919X,2326-9197,4801,1951
American Journal of Economics and Sociology,B,Wiley-Blackwell Publishing,0002-9246,1536-7150,3801,1941
American Journal of Evaluation,B,Sage Publications,1098-2140,1557-0878,3503,1981
American Journal of Finance and Accounting,B,Inderscience Publishers,1752-7767,1752-7775,3502,2008
American Journal of Health Economics,B,MIT Press,2332-3493,2332-3507,3801,2015
American Journal of Political Science,B,Wiley-Blackwell Publishing,0092-5853,1540-5907,3599,1950
American Journal of Psychology,B,University of Illinois Press,0002-9556,1939-8298,3507,1887
American Journal of Public Health,B,The American Public Health Association,0090-0036,1541-0048,3599,1911
American Journal of Recreation Therapy,B,Weston Medical Publishing,1539-4131,,3504,2002
American Journal of Sociology,B,The University of Chicago Press,0002-9602,1537-5390,3507,1895
American Law and Economics Review,B,Oxford University Press,1465-7252,1465-7260,3801,1999
American Political Science Review,B,Cambridge University Press,0003-0554,1537-5943,3599,1906
American Psychologist,B,American Psychological Association,0003-066X,1935-990X,3507,1946
American Review of Political Economy,B,American Review of Political Economy,1551-1383,,3899,2002
American Review of Public Administration,B,Sage Publications,0275-0740,1552-3357,3599,1967
American Sociological Review,B,Sage Publications,0003-1224,1939-8271,3507,1936
AMS Review,B,Springer International Publishing,1869-814X,1869-8182,3506,1997
Analisis: cuadernos de investigacion,B,Centre for Latin American Monetary Studies (CEMLA),0252-8851,,3801,1977
Anatolia,B,Taylor & Francis Online,1303-2917,2156-6909,3508,1990
Annals Economy Series,B,Universitatea Constantin Brancusi din Targu-Jiu,1844-7007,,3899,2009
Annals of Actuarial Science,B,Cambridge University Press,1748-4995,1748-5002,3502,2006
Annals of Applied Probability,B,Institute of Mathematical Statistics,1050-5164,2168-8737,4905,1991
Annals of Applied Statistics,B,Institute of Mathematical Statistics,1932-6157,1941-7330,4905,2007
Annals of Economics and Finance,B,Peking University Press,1529-7373,,3502,2000
Annals of Finance,B,Springer International Publishing,1614-2446,1614-2454,3502,2005
Annals of Leisure Research,B,Routledge,1174-5398,2159-6816,3504,1998
Annals of Operations Research,B,Springer International Publishing,0254-5330,1572-9338,3507,1984
Annals of Probability,B,Institute of Mathematical Statistics,0091-1798,2168-894X,4905,1973
Annals of Public and Cooperative Economics,B,Wiley-Blackwell Publishing,1370-4788,1467-8292,3801,1925
Annals of Statistics,B,Institute of Mathematical Statistics,0090-5364,,4905,1973
Annals of the American Academy of Political and Social Science,B,Sage Publications,0002-7162,1552-3349,3599,1891
Annals of the Institute of Statistical Mathematics,B,Springer International Publishing,0020-3157,1572-9052,4905,1949
Annals of Tourism Research,B,Elsevier,0160-7383,1873-7722,3508,1973
Annual Editions: Economics,B,Dushkin Publ. Group,1092-776X,,3801,1971
Annual Review of Banking and Financial Law,B,Boston University School of Law,1544-4627,,4801,1982
Annual Review of Economics,B,Annual Reviews,1941-1383,1941-1391,3801,2009
Annual Review of Financial Economics,B,Annual Reviews,1941-1367,1941-1375,3801,2009
Annual Review of Organizational Psychology and Organizational Behavior,B,Annual Reviews,2327-0616,,3507,2014
Annual Review of Psychology,B,Annual Reviews,0066-4308,1545-2085,3507,1950
Annual Review of Resource Economics,B,Annual Reviews,1941-1340,1941-1359,3801,2009
Annual Review of Sociology,B,Annual Reviews,0360-0572,1545-2115,3507,1975
Anti Trust Law Journal,B,American Bar Association,0003-6056,,4801,1952
Antitrust Bulletin,B,Sage Publications,0003-603X,1930-7969,4801,1955
Appetite,B,Elsevier,0195-6663,1095-8304,3506,1980
Applied Cognitive Psychology,B,Wiley-Blackwell Publishing,0888-4080,1099-0720,3507,1987
Applied Econometrics,B,"Moscow University for Industry and Finance Synergy"" """,1993-7601,2410-6445,3802,2006
Applied Econometrics and International Development,B,Euro-American Association of Economic Development Studies,1578-4487,,3802,2001
Applied Economic Analysis,B,Emerald Publishing Group,2632-7627,,3801,
Applied Economic Perspectives and Policy,B,Oxford University Press,2040-5804,2040-5970,3801,1979
Applied Economics,B,Taylor & Francis Online,0003-6846,1466-4283,3801,1969
Applied Economics Letters,B,Taylor & Francis Online,1350-4851,1466-4291,3801,1994
Applied Economics Quarterly,B,Duncker & Humblot Gmbh,1611-6607,1865-5122,3801,1952
Applied Energy,B,Elsevier,0306-2619,,3599,1975
Applied Finance Letters,B,Auckland University of Technology,2253-5799,2253-5802,3502,2012
Applied Financial Economics,B,Taylor & Francis Online,0960-3107,1466-4305,3502,1991
Applied Health Economics and Health Policy,B,Springer International Publishing,1175-5652,1179-1896,3801,2002
Applied Mathematical Finance,B,Taylor & Francis Online,1350-486X,1466-4313,3502,1994
Applied Ontology,B,IOS Press,1570-5838,,4609,2005
Applied Psychological Measurement,B,Sage Publications,0146-6216,1552-3497,3507,1977
Applied Psychology: An International Review,B,Wiley-Blackwell Publishing,0269-994X,1464-0597,3507,1952
Applied Soft Computing,B,Elsevier,1568-4946,1872-9681,4609,2001
Applied Stochastic Models in Business and Industry,B,Wiley-Blackwell Publishing,1524-1904,1526-4025,4905,1985
Appraisal Journal,B,Appraisal Institute,0003-7087,,3504,1932
Aquaculture Economics and Management,B,Taylor & Francis Online,1365-7305,1551-8663,3801,1997
Arizona Law Review,B,HeinOnline,0004-153X,,4801,1959
Arkansas Business and Economic Review,B,"University of Arkansas, Bureau of Business and Eco",0004-1742,,3801,1933
Art Law and Accounting Reporter,B,Volunteer Lawyers and Accountants for the Arts,0886-1013,,3501,1982
Artha-Vikas: a journal of economic development,B,Sardar Patel University,0004-3567,,3801,1965
Arts and the Market (formerly Arts Marketing),B,Emerald Group Publishing,2044-2084,2056-4945,3506,
ASEAN Journal on Hospitality and Tourism,B,Institut Teknologi Bandung,1412-2073,,3508,2002
Asia Europe Journal,B,Springer International Publishing,1610-2932,1612-1031,3599,2003
Asia Pacific Business Review,B,Taylor & Francis Online,1360-2381,1743-792X,3507,1994
Asia Pacific Sustainable Development Journal,B,United Nations ESCAP,1020-1246,,3899,1956
Asia Pacific Journal of Arts and Cultural Management,B,The University of Melbourne,1449-1184,,3504,2003
Asia Pacific Journal of Economics and Business,B,Taylor & Francis Online,1326-8481,,3801,1997
Asia Pacific Journal of Finance,B,Wiley-Blackwell Publishing,0219-1466,,3502,1998
Asia Pacific Journal of Health Management,B,Australian College of Health Service Executives,1833-3818,1833-3818,3599,2006
Asia Pacific Journal of Information Systems,B,Korea Society of Management Information Systems,2288-5404,2288-6818,4609,1990
Asia Pacific Journal of Management,B,Springer International Publishing,0217-4561,1572-9958,3507,1983
Asia Pacific Journal of Marketing and Logistics,B,Emerald Group Publishing,1355-5855,1758-4248,3506,1988
Asia Pacific Journal of Taxation,B,Hong Kong Polytechnic University,1027-5592,,4801,1997
Asia Pacific Journal of Tourism Research,B,Taylor & Francis Online,1094-1665,1741-6507,3508,1996
Asia Pacific Law Review,B,Taylor & Francis Online,1019-2557,1875-8444,4801,1992
Asia Pacific Public Relations Journal,B,University of Newcastle,1440-4389,1839-8227,3506,1999
Asia-Pacific Financial Markets,B,Springer International Publishing,1387-2834,1573-6946,3502,1994
Asia-Pacific Journal of Accounting and Economics,B,Taylor & Francis Online,1608-1625,2164-2257,3501,2000
Asia-Pacific Journal of Business Administration,B,Emerald Group Publishing,1757-4323,1757-4331,3507,2009
Asia-Pacific Journal of Financial Studies,B,Wiley-Blackwell Publishing,2041-9945,2041-6156,3502,1980
Asia-Pacific Journal of Human Resources,B,Wiley-Blackwell Publishing,1038-4111,1744-7941,3505,1966
Asia-Pacific Journal of Risk and Insurance,B,De Gruyter,2194-606X,2153-3792,3502,2005
Asia-Pacific Management Accounting Journal,B,Universiti Teknologi MARA (UiTM) Press,1675-3194,2550-1631,3501,2006
Asia-Pacific Management Review,B,Elsevier,1029-3132,2589-8213,3507,1996
Asia-Pacific Tax Bulletin,B,International Bureau of Fiscal Documentation,1385-3082,,4801,1983
Asian Academy of Management Journal,B,Penerbit Universiti Sains Malaysia,1394-2603,2180-4184,3507,1996
Asian Academy of Management Journal of Accounting and Finance,B,Asian Academy of Management / Penerbit Universiti Sains Malaysia,1823-4992,2180-4192,3501,2005
Asian and Pacific Economic Review,B,ya tai jing ji bian ji bu,1000-6052,,3801,1985
Asian and Pacific Migration Journal,B,Scalabrini Migration Center,0117-1968,2057-049X,3599,1992
Asian Business and Management,B,Springer International Publishing,1472-4782,1476-9328,3507,2002
Asian Development Review,B,MIT Press,0116-1105,0116-1105,3801,1983
Asian Economic Journal,B,Wiley-Blackwell Publishing,1351-3958,1467-8381,3801,1987
Asian Economic Papers,B,MIT Press,1535-3516,1536-0083,3801,2002
Asian Economic Policy Review,B,Wiley-Blackwell Publishing,1832-8105,1748-3131,3801,2006
Asian Economies,B,Ajia Keizai Kenkyujo,0002-2942,,3801,1960
Asian Journal of Accounting and Governance,B,Universiti Kebangsaan Malaysia (UKM) Press,2180-3838,,3501,2010
Asian Journal of Accounting Research,B,Emerald Group Publishing,2459-9700,2443-4175,3501,2016
Asian Journal of Agriculture and Development,B,Southeast Asian Regional Center for Graduate Study and Research in Agriculture,1656-4383,2599-3879,3899,2004
Asian Journal of Business and Accounting,B,University of Malaysia,1985-4064,2180-3137,3501,2008
Asian Journal of Business Ethics,B,Springer International Publishing,2210-6723,2210-6731,3507,2012
Asian Journal of Business Research,B,Asia Business Research Corporation Limited,2463-4522,1178-8933,3506,2011
Asian Journal of International Law,B,Cambridge University Press,2044-2513,2044-2521,4801,1997
Asian Journal of Management Cases,B,Sage Publications,0972-8201,0973-0621,3501,2004
Asian Journal of Marketing (SING),B,"Marketing Institute of Singapore and Faculty of Business Administration, National University of Singapore",0218-6101,,3506,1992
Asian Journal of Political Science,B,Taylor & Francis Online,0218-5377,1750-7812,3599,1993
Asian Journal of Social Science,B,Elsevier,1568-4849,1568-5314,3599,1973
Asian Journal of Tourism and Hospitality Research,B,Phillippine e-Journals,1908-8388,,3508,2007
Asian Population Studies,B,Taylor & Francis Online,1744-1730,1744-1749,3599,2005
Asian Review of Accounting,B,Emerald Group Publishing,1321-7348,1758-8863,3501,1992
Asian Survey,B,University of California Press,0004-4687,1533-838X,3599,2011
Asian-Pacific Economic Literature,B,Wiley-Blackwell Publishing,0818-9935,1467-8411,3801,1987
Aslib Proceedings: New information perspectives,B,Emerald Group Publishing,2050-3806,2050-3814,4609,1949
ASOR Bulletin,B,Australian Society for Operations Reseach Inc.,0812-860X,1446-6678,3509,1981
Asper Review of International Business and Trade Law,B,"University of Manitoba, Faculty of Law",1496-9572,,4801,2001
AStA Advances in Statistical Analysis,B,Springer Nature,1863-8171,1863-818X,4905,1916
ASTIN Bulletin,B,Cambridge University Press,0515-0361,1783-1350,3502,1960
ATA Journal of Legal Tax Research,B,American Accounting Association,1543-866X,,4801,2003
Atlantic Economic Journal,B,Springer International Publishing,0197-4254,1573-9678,3801,1973
Auckland University Law Review,B,Auckland University Law Students' Society,0067-0510,,4801,1967
Audit Financiar,B,Chamber of Financial Auditors in Romania,1583-5812,1844-8801,3501,2003
Auditing: A Journal of Practice and Theory,B,American Accounting Association,0278-0380,1558-7991,3501,1981
Australasian Accounting Business and Finance Journal,B,University of Canberra,1834-2000,1834-2019,3501,2007
Australasian Agribusiness Review,B,The University of Melbourne,1442-6951,,3599,1993
Australasian Dispute Resolution Journal,B,Thomson Reuters,1441-7847,1441-7847,4801,1990
Australasian Journal of Business and Behavioural Sciences,B,Australasian Business and Behavioural Sciences Association,1832-0422,,3501,2005
Australasian Journal of Economics Education,B,University of Queensland,1448-448X,1448-4498,3801,2004
Australasian Journal of Environmental Management,B,Taylor & Francis Online,1448-6563,2159-5356,3507,2003
Australasian Journal of Information Systems,B,Australasian Association for Information Systems (AAIS),1449-8618,1326-2238,4609,1983
Australasian Journal of Natural Resources Law and Policy,B,University of Wollongong,1320-5323,,4801,1993
Australasian Journal of Regional Studies,B,Australian and New Zealand Regional Science Association,1324-0935,,3599,1995
Australasian Journal on Ageing,B,Wiley-Blackwell Publishing,1440-6381,1741-6612,3599,1982
Australasian Marketing Journal,B,Elsevier,1441-3582,1839-3349,3506,1993
Australasian Parks and Leisure,B,Universal Magazines,1446-5604,,3504,
Australian Accounting Review,B,Wiley-Blackwell Publishing,1035-6908,1835-2561,3501,1991
Australian and New Zealand Journal of Criminology,B,Sage Publications,0004-8658,1837-9273,4801,1968
Australian and New Zealand Journal of Statistics,B,Wiley-Blackwell Publishing,1369-1473,1467-842X,4905,1959
Australian Bar Review,B,LexisNexis,0814-8589,,4801,1986
Australian Bulletin of Labour,B,"National Institute of Labour Studies, Flinders University",0311-6336,0311-6336,3505,1974
Australian Business Law Review,B,Thomson Reuters,0310-1053,,4801,1973
Australian Commodities,B,Australian Bureau of Agricultural and Resource Economics,1321-7844,,3801,1948
Australian Economic History Review,B,Wiley-Blackwell Publishing,0004-8992,1467-8446,3801,1956
Australian Economic Papers,B,Wiley-Blackwell Publishing,0004-900X,1467-8454,3801,1962
Australian GST Journal,B,Thomson Reuters,1445-4068,,4801,1998
Australian Intellectual Property Journal,B,Thomson Reuters,1038-1635,,4801,1990
Australian Journal of Actuarial Practice (formerly Australian Actuarial Journal),B,Institute of Actuaries of Australia,2203-2290,2203-5354,3502,1997
Australian Journal of Asian Law,B,Federation Press,1443-0738,,4801,2000
Australian Journal of Business and Management Research,B,New South Wales Research Centre Australia,,1839-0846,3501,2011
Australian Journal of Career Development,B,Sage Publications,1038-4162,2200-6974,3505,1992
Australian Journal of Competition and Consumer Law (formerly Trade Practices Law Journal),B,Thomson Reuters,1838-9260,,4801,1993
Australian Journal of Corporate Law,B,LexisNexis,1037-4124,,4801,1991
Australian Journal of Environmental Education,B,Cambridge University Press,0814-0626,2049-775X,3507,1984
Australian Journal of Human Rights,B,University of New South Wales,1323-238X,2573-573X,3599,1994
Australian Journal of International Affairs,B,Taylor & Francis Online,1035-7718,1465-332X,3599,1947
Australian Journal of Labour Economics: a journal of labour economics and labour relations,B,Centre for Labour Market Research,1328-1143,,3801,1989
Australian Journal of Labour Law,B,LexisNexis,1030-7222,,4801,1988
Australian Journal of Management,B,Sage Publications,0312-8962,1327-2020,3502,1976
Australian Journal of Political Science,B,Taylor & Francis Online,1036-1146,1363-030X,3599,1956
Australian Journal of Psychology,B,Wiley-Blackwell Publishing,0004-9530,1742-9536,3507,1949
Australian Journal of Public Administration,B,Wiley-Blackwell Publishing,0313-6647,1467-8500,3599,1937
Australian Journal of Social Issues,B,Wiley-Blackwell Publishing,0157-6321,0004-9557,3507,1961
