Journal Title,Rating,Publisher,ISSN,ISSN Online,FoR,Year Inception
Economic History of Developing Regions,B,Taylor & Francis Online,2078-0389,2078-0397,3801,1982
Economic Inquiry,B,Wiley-Blackwell Publishing,0095-2583,1465-7295,3801,1962
Economic Issues,B,Nottingham Trent University,1363-7029,,3801,1996
Economic Modelling,B,Elsevier,0264-9993,1873-6122,3801,1984
Economic Notes,B,Wiley-Blackwell Publishing,0391-5026,1468-0300,3801,1972
Economic Papers: a journal of applied economics and policy,B,Wiley-Blackwell Publishing,,1759-3441,3801,1941
Economic Policy: a European forum,B,Oxford University Press,0266-4658,1468-0327,3801,1985
Economic Policy / Ekonomicheskaya Politika,B,ANO Editorial Office of the Journal Economic Policy,1994-5124,2411-2658,3801,2013
Economic Quarter / Trimestre Economico,B,Fondo de Cultura Economica (Economic Culture Fund),0041-3011,2448-718X,3801,1934
Economic Review / Revue Economique,B,Presses de Sciences Po,0035-2764,1950-6694,3801,1950
Economic Sciences,B,Publishers ART,1505-4683,,3801,1985
Economic Studies / Estudios de Economia,B,Andros,0304-2758,0718-5286,3801,1973
Economic Studies Journal,B,Economic Research Institute at BAS,0205-3292,,3801,1998
Economic Systems,B,Elsevier Science,0939-3625,1878-5433,3899,1991
Economic Systems Research,B,Taylor & Francis Online,0953-5314,1469-5758,3899,1989
Economic Theory,B,Springer International Publishing,0938-2259,1432-0479,3803,1991
Economic Theory Bulletin,B,Springer International Publishing,2196-1085,2196-1093,3803,2014
Economic Thought Journal,B,American Economic Association,0205-1990,,3899,1996
Economica,B,Wiley-Blackwell Publishing,0013-0427,1468-0335,3801,1921
"Economics: The Open Access, Open Assessment E-journal",B,Universitaet Kiel,1864-6042,,3801,2007
Economics & Politics,B,Wiley-Blackwell Publishing,0954-1985,1468-0343,3801,1989
Economics and Applied Informatics,B,Galati University Press,1584-0409,2344-441X,3899,2003
Economics and Business Review,B,Poznan University of Economics Press,2392-1641,2450-0097,3801,2001
Economics and Finance in Indonesia,B,Institute for Economic and Social Research,0126-155X,2442-9260,3801,1953
Economics and Human Biology,B,Elsevier,1570-677X,1873-6130,3801,2003
Economics and Philosophy,B,Cambridge University Press,0266-2671,1474-0028,3801,1985
Economics and Policy of Energy and the Environment,B,Franco Angeli Edizioni,2280-7659,2280-7667,3899,1978
Economics Bulletin,B,Vanderbilt University,1545-2921,,3801,2001
Economics Letters,B,Elsevier,0165-1765,1873-7374,3801,1978
Economics of Education Review,B,Elsevier,0272-7757,1873-7382,3801,1981
Economics of Energy & Environmental Policy,B,International Association for Energy Economics,2160-5882,2160-5890,3801,2012
Economics of Governance,B,Springer International Publishing,1435-6104,1435-8131,3801,2000
Economics of Innovation and New Technology,B,Taylor & Francis Online,1043-8599,1476-8364,3801,1990
Economics of Transportation,B,Elsevier,2212-0122,,3509,2012
"Economics, Management, and Financial Markets",B,Addleton Academic Publishers,1842-3191,1938-212X,3801,2006
Economies,B,MDPI,,2227-7099,3801,2013
Economists' Voice,B,De Gruyter,2194-6167,1553-3832,3801,2004
Economy and Society,B,Taylor & Francis Online,0308-5147,1469-5766,3801,1972
"EDPACS: The EDP Audit, Control, and Security Newsletter",B,Taylor & Francis Online,0736-6981,1936-1009,3501,1973
Education Economics,B,Taylor & Francis Online,0964-5292,1469-5782,3801,1993
Education Finance and Policy,B,MIT Press,1557-3060,1557-3079,3801,2006
Educational and Psychological Measurement,B,Sage Publications,0013-1644,1552-3888,3505,1941
Educational Management Administration & Leadership,B,Sage Publications,1741-1432,1741-1440,3505,1972
eJournal of Tax Research,B,Australian School of Taxation and Business Law,1448-2398,,4801,2003
Ekonomia,B,University of Cyprus,1025-5508,1013-3224,3803,
Electronic Commerce Research,B,Springer International Publishing,1389-5753,1572-9362,4609,2001
Electronic Commerce Research and Applications,B,Elsevier,1567-4223,1873-7846,4609,2002
Electronic Communication Law Review,B,Kluwer Law International,1570-2294,,4801,1994
Electronic Journal of Evolutionary Modeling and Economic Dynamics,B,Universite Montesquieu Bordeaux IV,1298-0137,,3899,2000
Electronic Journal of IS Evaluation,B,Academic Conferences and Publishing International,1566-6379,,4609,2002
Electronic Journal of Knowledge Management,B,Academic Conferences and Publishing International,1479-4411,,4609,2003
Electronic Journal of Probability,B,Institute of Mathematical Statistics,,1083-6489,4905,1996
Electronic Journal of Information Systems in Developing Countries,B,Wiley-Blackwell Publishing,1681-4835,,4609,2000
Electronic Markets,B,Springer Nature,1019-6781,1422-8890,4609,1991
Emergence: complexity and organization,B,ISCE Publishing,1521-3250,,3507,1999
Emerging Markets Finance and Trade,B,Taylor & Francis Online,1540-496X,1558-0938,3502,2008
Emerging Markets Review,B,Elsevier,1566-0141,1873-6173,3502,2000
Empirica,B,Springer International Publishing,0340-8744,1573-6911,3801,1974
Empirical Economics,B,Springer International Publishing,0377-7332,1435-8921,3801,1976
Empirical Economics Letters,B,Dr. Mohammad A. Wadud,1681-8997,,3801,2002
Employee Relations,B,Emerald Group Publishing,0142-5455,1758-7069,3505,1979
Employee Relations Law Journal,B,"Aspen Publishers, Inc.",0098-8898,,4801,1975
Employee Responsibilities and Rights Journal,B,Springer International Publishing,0892-7545,1573-3378,3505,1988
Energy and Environment,B,Sage Publications,0958-305X,2048-4070,3599,1990
Energy Economics,B,Elsevier,0140-9883,1873-6181,3801,1979
Energy Journal,B,International Association for Energy Economics,0195-6574,1944-9089,3801,1980
Energy Policy,B,Elsevier,0301-4215,1873-6777,3599,1973
"Energy Sources, Part B: Economics, Planning, and Policy",B,Taylor & Francis Online,1556-7249,1556-7257,3801,2006
Energy Studies Review,B,"DeGroote School of Business, McMaster University",0843-4379,,3899,1980
Engineering Economics,B,Kaunas University of Technology,1392-2785,2029-5839,3801,1989
Engineering Economist,B,Taylor & Francis Online,0013-791X,1547-2701,3801,1955
"Engineering, Construction and Architectural Management",B,Emerald Group Publishing,0969-9988,1365-232X,3504,1994
Enometrica,B,University of Macarata,1974-4730,,3899,2008
Enterprise and Society,B,Cambridge University Press,1467-2227,1467-2235,3505,2000
Enterprise Development & Microfinance,B,Practical Action Publishing,1755-1978,1755-1986,3801,1990
Enterprise Governance eJournal,B,Bond Faculty of Law,2651-9615,,4801,2005
Enterprise Information Systems,B,Taylor & Francis Online,1751-7575,1751-7583,4609,2007
Entertainment Law Review,B,Sweet & Maxwell,0959-3799,,4801,1990
Entrepreneurial Business Law Journal,B,"Ohio State University, Moritz College of Law",1932-4480,1932-4472,4801,2006
Entrepreneurship and Regional Development,B,Taylor & Francis Online,0898-5626,1464-5114,3507,1989
Entrepreneurship Research Journal,B,Walter de Gruyter GmbH,2194-6175,2157-5665,3507,2011
Entrepreneurship Theory and Practice,B,Sage Publications,1042-2587,1540-6520,3507,1976
Environment and Development Economics,B,Cambridge University Press,1355-770X,1469-4395,3801,1996
Environment and Planning A: Economy and Space,B,Sage Publications,0308-518X,1472-3409,3599,1968
Environment and Planning B: planning and design,B,Sage Publications,0265-8135,1472-3417,3599,1969
Environment and Planning C: politics and space,B,Sage Publications,0263-774X,,3599,1983
Environment and Planning D: society and space,B,Sage Publications,0263-7758,1472-3433,3599,1983
Environment and Urbanization Asia,B,Sage Publications,0975-4253,0976-3546,3599,2009
Environmental and Ecological Statistics,B,Springer International Publishing,1352-8505,1573-3009,4905,1994
Environmental and Planning Law Journal,B,Thomson Reuters,0813-300X,,4801,1984
Environmental and Resource Economics,B,Springer International Publishing,0924-6460,1573-1502,3801,1991
Environmental Economics and Policy Studies,B,Springer International Publishing,1432-847X,1867-383X,3801,1998
Environmental Education Research,B,Taylor & Francis Online,1350-4622,1469-5871,3599,1995
Environmental Innovation and Societal Transitions,B,Elsevier,,2210-4224,3599,2011
Environmental Management,B,Springer International Publishing,0364-152X,1432-1009,3507,1977
Environmetrics,B,Wiley-Blackwell Publishing,1180-4009,1099-095X,4905,1990
"Equality, Diversity and Inclusion",B,Emerald Group Publishing,2040-7149,2040-7157,3505,1981
Erasmus Journal for Philosophy and Economics,B,Erasmus University,1876-9098,,3899,2008
Erasmus Law and Economics Review,B,Erasmus Law and Economics Students Society,1824-3886,,4801,2004
ESAIM: Probability and Statistics,B,EDP Sciences,1292-8100,1262-3318,4905,1997
Essays in Economic & Business History,B,The Economic and Business History Society,0896-226X,2376-9459,3801,1979
Estudos Economicos,B,Universidade de Sao Paulo,0101-4161,0101-4161,3801,1970
Ethics and Economics,B,University of Versailles,1639-1306,,3899,2003
Ethics and Information Technology,B,Springer International Publishing,1388-1957,1572-8439,4609,1999
"Ethics: an international journal of social, political, and legal philosophy",B,The University of Chicago Press,0014-1704,1539-297X,3507,1888
Eurasian Business Review,B,Springer International Publishing,1309-4297,2147-4281,3801,2011
Eurasian Economic Review,B,Springer International Publishing,1309-422X,2147-429X,3801,2011
Eurasian Geography and Economics,B,Taylor & Francis Online,1538-7216,1938-2863,3899,1960
Eurasian Journal of Business and Economics,B,Ala-Too International University,1694-5948,1694-5972,3501,2008
EURO Journal on Transportation and Logistics,B,Springer International Publishing,2192-4376,2192-4384,3509,2012
EuroChoices,B,Wiley-Blackwell Publishing,,1746-692X,3801,2001
EuroMed Journal of Business,B,Emerald Group Publishing,1450-2194,1758-888X,3507,2006
Europe-Asia Studies,B,Taylor & Francis Online,0966-8136,1465-3427,3599,1949
European Actuarial Journal,B,Springer International Publishing,2190-9733,2190-9741,3502,2011
European Business Law Review,B,Kluwer Law International,0959-6941,1875-841X,4801,1988
European Business Organization Law Review,B,Springer Nature,1566-7529,1741-6205,4801,2000
European Business Review,B,Emerald Group Publishing,0955-534X,1758-7107,3507,1989
European Company Law,B,Kluwer Law International,1572-4999,1875-6530,4801,2002
European Competition Journal,B,Taylor & Francis Online,1744-1056,1757-8396,4801,2005
European Competition Law Review,B,Sweet & Maxwell,0144-3054,,4801,1980
European Economic Letters,B,European Economics Letters Groups,2323-5233,2323-5233,3801,2012
European Economic Review,B,Elsevier,0014-2921,1873-572X,3801,1969
European Financial Management,B,Wiley-Blackwell Publishing,1354-7798,1468-036X,3502,1995
European Intellectual Property Review,B,Sweet & Maxwell,0142-0461,1749-5083,4801,1978
European Journal of Communication,B,Sage Publications,0267-3231,1460-3705,3599,1986
European Journal of Comparative Economics,B,European Association for Comparative Economics Systems / LIUC University Press,1824-2979,,3899,2004
European Journal of Development Research,B,Springer International Publishing,0957-8811,1743-9728,3801,1989
European Journal of Economics and Economic Policies: Intervention,B,Edward Elgar Publishing,2052-7764,2052-7772,3801,2004
European Journal of Government and Economics,B,Europa Grande,2254-7088,,3899,2012
European Journal of Health Economics,B,Springer International Publishing,1618-7598,1618-7601,3801,2002
European Journal of Industrial Relations,B,Sage Publications,0959-6801,1461-7129,3505,1995
European Journal of Information Systems,B,Taylor & Francis Online,0960-085X,1476-9344,4609,1991
European Journal of Innovation Management,B,Emerald Group Publishing,1460-1060,1758-7115,3507,1998
European Journal of International Law,B,Oxford University Press,0938-5428,1464-3596,4801,1990
European Journal of International Management,B,Inderscience,1751-6757,1751-6765,3507,2007
European Journal of International Relations,B,Sage Publications,1354-0661,1460-3713,3599,1995
European Journal of Law and Economics,B,Springer International Publishing,0929-1261,1572-9990,4801,1994
European Journal of Management Studies,B,Emerald Group Publishing,2183-4172,2635-2648,3507,1993
European Journal of Marketing,B,Emerald Group Publishing,0309-0566,1758-7123,3506,1967
European Journal of Operational Research,B,Elsevier,0377-2217,1872-6860,3507,1977
European Journal of Personality,B,Wiley-Blackwell Publishing,0890-2070,1099-0984,3507,1987
European Journal of Political Economy,B,Elsevier,0176-2680,1873-5703,3801,1985
European Journal of Political Research,B,Wiley-Blackwell Publishing,0304-4130,1475-6765,3599,1973
European Journal of Population,B,Springer International Publishing,0168-6577,1572-9885,3599,1985
European Journal of Psychological Assessment,B,Hogrefe Publishing Corp,1015-5759,2151-2426,3507,1985
European Journal of Public Health,B,Oxford University Press,1101-1262,1464-360X,3599,1991
European Journal of Social Psychology,B,Wiley-Blackwell Publishing,0046-2772,1099-0992,3507,1971
European Journal of Sociology,B,Cambridge University Press,0003-9756,1474-0583,3507,1960
European Journal of the History of Economic Thought,B,Taylor & Francis Online,0967-2567,1469-5936,3803,1993
European Journal of Training and Development,B,Emerald Group Publishing,2046-9012,,3505,1977
European Journal of Transport and Infrastructure Research,B,Delft University of Technology,1567-7133,1567-7141,3509,2000
European Journal of Work and Organizational Psychology,B,Taylor & Francis Online,1359-432X,1464-0643,3507,1991
European Law Journal,B,Wiley-Blackwell Publishing,1351-5993,1468-0386,4801,1995
European Law Review,B,Sweet & Maxwell,0307-5400,,4801,1975
European Management Journal,B,Elsevier,0263-2373,1873-5681,3507,1982
European Management Review,B,Wiley-Blackwell Publishing,1740-4754,1740-4762,3507,2004
European Review of Agricultural Economics,B,Oxford University Press,0165-1587,1464-3618,3801,1973
European Review of Economic History,B,Oxford University Press,1361-4916,1474-0044,3801,1997
European Sport Management Quarterly,B,Taylor & Francis Online,1618-4742,1746-031X,3504,2001
European Taxation,B,International Bureau of Fiscal Documentation,0014-3138,,4801,1961
European Transport / Trasporti Europei,B,Giordano Editore,1825-3997,2283-5520,3509,1995
European Transport Law,B,Wijfells,0014-3154,,4801,1966
European Urban and Regional Studies,B,Sage Publications,0969-7764,1461-7145,3599,1994
Evaluation,B,Sage Publications,1356-3890,1461-7153,3507,1995
Evaluation Review,B,Sage Publications,0193-841X,1552-3926,3599,1977
Event Management,B,Cognizant Communication Corporation,1525-9951,1943-4308,3508,1993
Evidence-based HRM,B,Emerald Group Publishing,2049-3983,2049-3991,3505,2013
Experimental Economics,B,Springer International Publishing,1386-4157,1573-6938,3801,1998
Expert Review of Pharmacoeconomics & Outcomes Research,B,Taylor & Francis Online,1473-7167,1744-8379,3801,2001
Expert Systems with Applications,B,Elsevier,0957-4174,1873-6793,4609,1990
Explorations in Economic History,B,Elsevier,0014-4983,1090-2457,3801,1963
Facilities,B,Emerald Group Publishing,0263-2772,1758-7131,3504,1983
Facta Universitatas: Economics and Organization,B,University of Nis,0354-4699,2406-050X,3501,1993
Faith and Economics,B,American Theological Libraries Association,0896-307X,,3899,
Family Business Review,B,Sage Publications,0894-4865,1741-6248,3507,1988
Farm and Business - The Journal of the Caribbean Agro-Economic Society,B,Caribbean Agro-Economic Society,1019-035X,,3899,1992
Federal Law Review,B,Australian National University,0067-205X,,4801,1964
Feminist Economics,B,Taylor & Francis Online,1354-5701,1466-4372,3801,1995
FIIB Business Review,B,Sage Publications,2319-7145‎,2455-2658,3507,2014
Finance,B,Association Francaise de Finance,0752-6180,,3502,1980
Finance and Stochastics,B,Springer International Publishing,0949-2984,1432-1122,3502,1996
Finance India,B,Indian Institute of Finance,0970-3772,,3502,1987
Finance Research Letters,B,Elsevier,1544-6123,1544-6131,3502,2004
Financial Accountability and Management,B,Wiley-Blackwell Publishing,0267-4424,1468-0408,3501,1985
Financial Analysts Journal,B,Taylor & Francis Online,0015-198X,1938-3312,3502,1945
Financial History Review,B,Cambridge University Press,0968-5650,1474-0052,3502,1994
Financial Management,B,Wiley-Blackwell Publishing,0046-3892,1755-053X,3502,1972
Financial Markets and Portfolio Management,B,Springer International Publishing,1934-4554,2373-8529,3502,1987
"Financial Markets, Institutions and Instruments",B,Wiley-Blackwell Publishing,0963-8008,1468-0416,3502,1992
Financial Planning Research Journal,B,Griffith University on behalf of FPA Australia,2206-1355,,3502,2015
Financial Reporting,B,Franco Angeli,2036-671X,2036-6779,3501,2011
"Financial Reporting, Regulation & Governance",B,,1449-2318,1449-2318,3501,2004
Financial Review (US),B,Wiley-Blackwell Publishing,0732-8516,1540-6288,3502,1969
Financial Services Newsletter,B,LexisNexis,1035-2155,1447-137X,4801,1985
Financial Services Review,B,Academy of Financial Services - Elsevier,1057-0810,1873-5673,3502,1992
Financijska Teorija i Praksa,B,Institute of Public Finance,1332-3970,1333-9354,3801,1977
Finnish Economic Papers,B,Finnish Economic Association,0784-5197,1798-7423,3801,1988
First Monday,B,University of Illinois Press,1396-0466,,4609,1996
Fiscal Studies,B,Wiley-Blackwell Publishing,0143-5671,1475-5890,3801,1979
Flexible Services and Manufacturing Journal,B,Springer International Publishing,1936-6582,1936-6590,3507,1988
Food Policy,B,Elsevier,0306-9192,1873-5657,3801,1975
Food Quality and Preference,B,Elsevier,0950-3293,,3506,1988
Fordham Journal of Corporate & Financial Law,B,Fordham Law School,1532-303X,,4801,1996
Foreign Affairs,B,Council on Foreign Relations,0015-7120,1665-1707,3599,1910
Foreign Policy (Washington),B,"National Affairs, Inc.",0015-7228,1945-2276,3599,1971
Foreign Trade Review,B,Sage Journals,0015-7325,0971-7625,3801,1966
Foresight,B,Emerald,1463-6689,1465-9832,3599,1999
Forest Policy and Economics,B,Elsevier,1389-9341,1872-7050,3801,2000
Forum for Health Economics and Policy,B,De Gruyter,2194-6191,1558-9544,3899,1998
Forum for Social Economics,B,Taylor & Francis Online,0736-0932,1874-6381,3801,1975
Forum of International Development Studies,B,Nagoya University,1341-3732,,3899,1994
Foundations and Trends in Accounting,B,Now Publishers,1554-0642,1554-0650,3501,2006
Foundations and Trends in Econometrics,B,Now Publishers,1551-3076,1551-3084,3802,2005
Foundations and Trends in Entrepreneurship,B,Now Publishers,1551-3114,1551-3122,3507,2005
Foundations and Trends in Finance,B,Now Publishers,1567-2395,1567-2409,3502,2005
Foundations and Trends in Microeconomics,B,Now Publishers,1547-9846,1547-9854,3801,2005
Frontiers in Finance and Economics,B,PHI,1814-2044,,3502,2004
Frontiers of Economics in China,B,Higher Education Press,1673-3444,1673-3568,3801,2006
Futures,B,Elsevier,0016-3287,1873-6378,3507,1968
Fuzzy Economic Review,B,International Association for Fuzzy-Set Management and Economy,1136-0593,2445-4192‎,3801,1995
Gambling Research,B,National Association for Gambling Studies,1832-4975,,3504,2002
Games,B,MDPI,2073-4336,,3803,2010
Games and Economic Behavior,B,Elsevier,0899-8256,1090-2473,3803,1989
Gender and Society,B,Sage Publications,0891-2432,1552-3977,3507,1987
Gender in Management: an international journal,B,Emerald Group Publishing,1754-2413,1754-2421,3505,1985
"Gender, Work and Organization",B,Wiley-Blackwell Publishing,0968-6673,1468-0432,3505,1994
German Economic Review,B,Wiley-Blackwell Publishing,1465-6485,1468-0475,3801,2000
German Journal of Agricultural Economics,B,dfv Mediengruppe,0002-1121,,3899,1952
German Journal of Human Resource Management,B,Sage Publications,2397-0022,2397-0030,3505,1987
Global Business and Economics Review,B,Inderscience Enterprises Ltd.,1097-4954,1745-1329,3801,1999
Global Business and Organizational Excellence,B,Wiley-Blackwell Publishing,1932-2054‎,1932-2062‎,3507,1981
Global Business Review,B,Sage Publications,0972-1509,0973-0664,3507,2000
Global Economic Review,B,Taylor & Francis Online,1226-508X,1744-3873,3801,1973
Global Economy Journal,B,De Gruyter,2194-5659,1553-5304,3801,2000
Global Environmental Change,B,Elsevier,0959-3780,1872-9495,3599,1990
Global Environmental Politics,B,MIT Press,1526-3800,1536-0091,3599,2001
Global Finance Journal,B,Elsevier,1044-0283,1873-5665,3502,1989
Global Journal of Accounting and Finance,B,Institute for Global Business Research,2574-0474,2574-0482,3501,2017
Global Journal of Flexible Systems Management,B,Springer Nature,0972-2696,0974-0198,3507,2000
"Global Knowledge, Memory and Communication",B,Emerald Group Publishing,2514-9342,2514-9350,4609,2018
Global Networks: A Journal of Transnational Affairs,B,Wiley-Blackwell Publishing,1470-2266,1471-0374,3599,2001
Global Perspectives on Accounting Education,B,Global Perspectives on Accounting Education,,1543-2955,3501,2004
Global Social Policy,B,Sage Publications,1468-0181,1741-2803,3599,2001
Global Strategy Journal,B,Wiley-Blackwell Publishing,2042-5791,2042-5805,3507,
Gospodarka Narodowa,B,"Instytut Gospodarki Narodowej, Warsaw",0867-0005,2300-5238,3801,1946
Government Information Quarterly,B,Elsevier,0740-624X,1872-9517,4609,1984
Griffith Law Review,B,Griffith University,1038-3441,1839-4205,4801,1992
Group & Organization Management,B,Sage Publications,1059-6011,1552-3993,3507,1976
Group Decision and Negotiation,B,Springer International Publishing,0926-2644,1572-9907,4609,1992
"Group Dynamics: theory, research and practice",B,American Psychological Association,1089-2699,1930-7802,3599,1997
Group Processes and Intergroup Relations,B,Sage Publications,1368-4302,1461-7188,3507,1998
Growth and Change,B,Wiley-Blackwell Publishing,0017-4815,1468-2257,3801,1970
Habitat International,B,Elsevier,0197-3975,1873-5428,3504,1976
Harvard Business Review,B,Harvard Business Publishing,0017-8012,,3507,1922
Harvard Environmental Law Review,B,Harvard Environmental Law Review,0147-8257,,4801,1976
Harvard International Law Journal,B,Harvard University Press,0017-8063,2153-2494,4801,1960
Harvard Journal of Law and Public Policy,B,Harvard Society for Law and Public Policy,0193-4872,2374-6572,4801,1978
Harvard Journal of Law and Technology,B,Harvard University Press,0897-3393,2153-263X,4801,1988
Harvard Law Review,B,Harvard University Press,0017-811X,2161-976X,4801,1886
Hastings Business Law Journal,B,University of California Press,1554-849X,1554-8503,4801,2005
Health Care Management Review,B,Lippincott Williams & Wilkins,0361-6274,1550-5030,3507,1976
Health Care Management Science,B,Springer International Publishing,1386-9620,1572-9389,3507,1998
Health Communication,B,Taylor & Francis Online,1041-0236,1532-7027,3599,1989
Health Economics,B,Wiley-Blackwell Publishing,1057-9230,1099-1050,3801,1992
Health Economics Review,B,Springer International Publishing,,2191-1991,3801,2011
"Health Economics, Policy and Law",B,Cambridge University Press,1744-1331,1744-134X,3801,2006
Health Informatics Journal,B,Sage Publications,1460-4582,1741-2811,4609,1995
Health Marketing Quarterly,B,Taylor & Francis Online,0735-9683,1545-0864,3506,1983
Health Policy,B,Elsevier,0168-8510,1872-6054,3801,1984
Health Policy and Technology,B,Elsevier,2211-8837,2211-8845,4609,
Health Promotion International,B,Oxford University Press,0957-4824,1460-2245,3506,1986
Health Services and Outcomes Research Methodology,B,Springer International Publishing,1387-3741,1572-9400,3507,2000
Health Services Management Research,B,Sage Publications,0951-4848,1758-1044,3599,1988
Health Services Research,B,Wiley-Blackwell Publishing,0017-9124,1475-6773,3599,1966
Higher Education Quarterly,B,Wiley-Blackwell Publishing,0951-5224,1468-2273,3505,1947
"Higher Education, Skills and Work-based Learning",B,Emerald Group Publishing,2042-3896,2042-390X,3505,2010
Historical Materialism,B,Brill,1465-4466,1569-206X,3803,1997
Historical Studies in Industrial Relations,B,Liverpool University Press,1362-1572,2049-4459,3505,1996
History of Economic Ideas,B,Fabrizio Serra Editore,1122-8792,1724-2169,3899,1993
History of Economic Thought and Policy,B,Franco Angeli Edizioni,2240-9971,2280-188X,3899,2004
History of Economics Review,B,Taylor & Francis Online,1037-0196,1838-6318,3803,1981
History of Political Economy,B,Duke University Press,0018-2702,1527-1919,3803,1969
Hitotsubashi Journal of Economics,B,Sanseido Publishing Company Ltd,0018-280X,,3801,1960
Homo Oeconomicus,B,Springer International Publishing,0943-0180,2366-6161,3801,1983
Hong Kong Law Journal,B,Thomson Reuters,0378-0600,,4801,1971
Hospitality & Society,B,Intellect Publishing,2042-7913,2042-7921,3504,2011
Housing Policy Debate,B,Taylor & Francis Online,1051-1482,2152-050X,3801,1990
Housing Studies,B,Taylor & Francis Online,0267-3037,1466-1810,3504,1986
Houston Business and Tax Law Journal,B,University of Houston Law Center,1543-2602,,4801,2001
Human Communication Research,B,Oxford University Press,0360-3989,1468-2958,3507,1974
Human IT,B,Centre for Information Technology Studies as a Human Science (ITH),1402-1501,1402-151X,4609,1997
Human Performance,B,Taylor & Francis Online,0895-9285,1532-7043,3507,1988
Human Relations,B,Sage Publications,0018-7267,1741-282X,3507,1947
Human Resource Development International,B,Taylor & Francis Online,1367-8868,1469-8374,3505,1998
Human Resource Development Quarterly,B,Wiley-Blackwell Publishing,1044-8004,1532-1096,3505,1990
Human Resource Development Review,B,Sage Publications,1534-4843,1552-6712,3505,2002
Human Resource Management (US),B,Wiley-Blackwell Publishing,0090-4848,1099-050X,3505,1961
