Journal Title,Rating,Publisher,ISSN,ISSN Online,FoR,Year Inception
International Journal of Portfolio Analysis and Management,B,Inderscience Enterprises Ltd.,2048-2361,2048-237X,3502,2012
International Journal of Production Economics,B,Elsevier,0925-5273,1873-7579,3507,1976
International Journal of Production Research,B,Taylor & Francis Online,0020-7543,1366-588X,3507,1961
International Journal of Productivity and Performance Management,B,Emerald Group Publishing,1741-0401,1758-6658,3505,1952
International Journal of Project Management,B,Elsevier,0263-7863,1873-4634,3503,1983
International Journal of Public Administration,B,Taylor & Francis Online,0190-0692,1532-4265,3507,1979
International Journal of Public Opinion Research,B,Oxford University Press,,1471-6909,3506,1989
International Journal of Public Sector Management,B,Emerald Group Publishing,0951-3558,1758-6666,3507,1988
International Journal of Quality & Reliability Management,B,Emerald Group Publishing,0265-671X,1758-6682,3507,1984
International Journal of Quality and Service Sciences,B,Emerald Group Publishing Limited,1756-669X,1756-6703,3506,2009
International Journal of Research in Marketing,B,Elsevier,0167-8116,1873-8001,3506,1984
International Journal of Retail & Distribution Management,B,Emerald Group Publishing,0959-0552,1758-6690,3506,1973
International Journal of Revenue Management,B,Inderscience Enterprises Ltd.,1474-7332,1741-8186,3502,2007
International Journal of Risk Assessment and Management,B,Inderscience Enterprises Ltd,1466-8297,1741-5241,3502,2000
International Journal of Selection and Assessment,B,Wiley-Blackwell Publishing,0965-075X,1468-2389,3505,1993
International Journal of Social Economics,B,Emerald Group Publishing,0306-8293,1758-6712,3899,1974
International Journal of Social and Humanistic Computing,B,Inderscience Enterprises Ltd.,1752-6124,1752-6132,4609,2008
International Journal of Social Research Methodology,B,Taylor & Francis Online,1364-5579,1464-5300,3507,1998
International Journal of Sociology and Social Policy,B,Emerald Group Publishing,0144-333X,1758-6720,3507,1981
International Journal of Spa and Wellness,B,Taylor & Francis Online,2472-1735,2472-1743,3508,2018
International Journal of Sport Communication,B,"Human Kinetics Publishers, Inc.",1936-3915,1936-3907,3504,2008
International Journal of Sport Finance,B,FIT Publishing,1558-6235,1930-076X,3504,2006
International Journal of Sport Management,B,"American Press, Boston",1546-234X,,3504,2000
International Journal of Sport Policy and Politics,B,Taylor & Francis Online,1940-6940,1940-6959,3504,2009
International Journal of Sport Psychology,B,"Edizioni Luigi Pozzi, Rome",0047-0767,,3504,1970
International Journal of Sports Management and Marketing,B,Inderscience Enterprises Ltd.,1475-8962,1740-2808,3506,2005
International Journal of Sports Marketing and Sponsorship,B,Emerald Group Publishing,1464-6668,2515-7841,3506,1999
International Journal of Stochastic Analysis,B,,2090-3332,2090-3340,4905,1987
International Journal of Strategic Communication,B,Taylor & Francis Online,1553-118X,1553-1198,3506,2007
International Journal of Strategic Property Management,B,Vilnius Gediminas Technical University,1648-715X,1648-9179,3504,1997
International Journal of Stress Management,B,American Psychological Association,1072-5245,1573-3424,3505,1994
International Journal of Sustainable Design,B,Inderscience Enterprises Ltd.,1743-8284,1743-8292,3506,2008
International Journal of Sustainable Economy,B,Inderscience Enterprises Ltd.,1756-5804,1756-5812,3801,2012
International Journal of Sustainable Transportation,B,Taylor & Francis Online,1556-8318,1556-8334,3509,2007
International Journal of Technology and Human Interaction,B,IGI Global,1548-3908,1548-3916,4609,2005
International Journal of Technology Management,B,Inderscience Enterprises Ltd.,0267-5730,1741-5276,3503,1986
International Journal of Technology Management and Sustainable Development,B,Intellect,1474-2748,2040-0551,3506,2002
International Journal of Technology Marketing,B,Inderscience Enterprises Ltd.,1741-878X,1741-8798,3506,2005
"International Journal of Technology, Knowledge and Society",B,Common Ground Research Networks,1832-3669,,4609,2006
International Journal of the Economics of Business,B,Taylor & Francis Online,1357-1516,1466-1829,3899,1994
International Journal of Theoretical and Applied Finance,B,World Scientific Publishing,0219-0249,1793-6322,3502,1998
International Journal of Tourism Cities,B,Emerald Group Publishing,2056-5607,2056-5615,3508,2015
International Journal of Tourism Policy,B,Inderscience Enterprises Ltd.,1750-4090,1750-4104,3508,2007
International Journal of Tourism Research,B,Wiley-Blackwell Publishing,1099-2340,1522-1970,3508,1998
International Journal of Tourism Sciences,B,Taylor & Francis Online,1598-0634,2377-0058,3508,2000
International Journal of Trade and Global Markets,B,Inderscience Enterprises Ltd.,1742-7541,1742-755X,3506,2007
International Journal of Training and Development,B,Wiley-Blackwell Publishing,1360-3736,1468-2419,3505,1997
International Journal of Transport Economics,B,Istituti Editorialie Poligrafici Internazionali Pisa,0303-5247,1724-2185,3509,1974
International Journal of Urban and Regional Research,B,Wiley-Blackwell Publishing,0309-1317,1468-2427,3801,1977
"International Journal of Vehicle Design: journal of vehicle engineering, automotive technology and components",B,Inderscience Publishers,0143-3369,1741-5314,3509,1979
International Journal of Volunteer Administration,B,North Carolina State University,,1942-728X,3507,2006
International Journal of Web Based Communities,B,Inderscience Enterprises Ltd.,1477-8394,1741-8216,4609,2004
International Journal of Wine Business Research,B,Emerald Group Publishing,1751-1062,1751-1070,3504,1988
International Journal of Work Organisation and Emotion,B,Inderscience Enterprises Ltd.,1740-8938,1740-8946,3507,2005
International Labor and Working-Class History,B,Cambridge University Press,0147-5479,1471-6445,3899,1972
International Labour Review,B,Wiley-Blackwell Publishing,0020-7780,1564-913X,3505,1921
International Marketing Review,B,Emerald Group Publishing,0265-1335,1758-6763,3506,1983
International Migration,B,Wiley-Blackwell Publishing,0020-7985,1468-2435,3599,1961
International Migration Review,B,Sage Publications,0197-9183,1747-7379,3599,1966
International Negotiation: a journal of theory and practice,B,Brill,1382-340X,1571-8069,3505,1996
International Organization,B,Cambridge University Press,0020-8183,1531-5088,3801,1947
International Papers in Political Economy,B,Palgrave Macmillan,,,3801,2005
International Public Management Journal,B,Taylor & Francis Online,1096-7494,1559-3169,3507,1998
International Real Estate Review,B,Asian Real Estate Society,2154-8919,,3504,1998
International Regional Science Review,B,Sage Publications,0160-0176,1552-6925,3899,1975
International Review for the Sociology of Sport,B,Sage Publications,1012-6902,1461-7218,3504,1966
International Review of Administrative Sciences,B,Sage Publications,0020-8523,1461-7226,3507,1957
International Review of Applied Economics,B,Taylor & Francis Online,0269-2171,1465-3486,3801,1987
International Review of Economics,B,Springer International Publishing,1865-1704,1863-4613,3801,1954
International Review of Economics & Finance,B,Elsevier,1059-0560,1873-8036,3502,1992
International Review of Economics Education,B,Elsevier,1477-3880,,3801,2003
International Review of Environmental and Resource Economics,B,Now Publishers,1932-1465,1932-1473,3801,2007
International Review of Finance,B,Wiley-Blackwell Publishing,1369-412X,1468-2443,3502,2000
International Review of Financial Analysis,B,Elsevier,1057-5219,1873-8079,3502,1992
International Review of Information Ethics,B,International Center for Information Ethics (ICIE),1614-1687,,4609,2004
International Review of Law and Economics,B,Elsevier,0144-8188,1873-6394,3801,1981
"International Review of Law, Computers and Technology",B,Taylor & Francis Online,1360-0869,1364-6885,4801,1984
International Review of Public Administration,B,Taylor & Francis Online,1229-4659,2331-7795,3599,1999
"International Review of Retail, Distribution and Consumer Research",B,Taylor & Francis Online,0959-3969,1466-4402,3506,1990
International Review on Public and Nonprofit Marketing,B,Springer International Publishing,1865-1984,1865-1992,3506,2004
International Small Business Journal,B,Sage Publications,0266-2426,1741-2870,3507,1982
International Social Science Journal,B,Wiley-Blackwell Publishing,,1468-2451,3599,1949
International Statistical Review,B,Wiley-Blackwell Publishing,0306-7734,1751-5823,4905,1932
International Studies of Management & Organization,B,Taylor & Francis Online,0020-8825,1558-0911,3507,1971
International Studies Quarterly,B,Wiley-Blackwell Publishing,0020-8833,1468-2478,3599,1957
International Tax and Public Finance,B,Springer International Publishing,0927-5940,1573-6970,4801,1994
International Tax Journal,B,Panel Publishers,0097-7314,,4801,1974
International Tax Review,B,Euromoney Institutional Investor PLC,0958-7594,,4801,1989
International Trade Journal,B,Taylor & Francis Online,0885-3908,1521-0545,3801,1986
International Transactions in Operational Research,B,Wiley-Blackwell Publishing,0969-6016,1475-3995,3509,1994
International Transfer Pricing Journal,B,International Bureau of Fiscal Documentation,1385-3074,,4801,1993
International VAT Monitor,B,International Bureau of Fiscal Documentation,0925-0832,,4801,1990
Internet Research,B,Emerald Group Publishing,1066-2243,2054-5657,4609,1991
Intertax: International Tax Review,B,Kluwer Law International,0165-2826,1875-8347,4801,1971
Investment Analysts Journal,B,Taylor & Francis Online,1029-3523,2077-0227,3502,1972
Investment Management and Financial Innovations,B,Business Perspectives Ltd,1810-4967,1812-9358,3502,2004
IPPR Progressive Review,B,Wiley-Blackwell Publishing,,2573-2331,3599,1994
Irish Journal of Management,B,Sciendo,1649-248X,2451-2834,3507,1982
Irish Marketing Review,B,University of Strathclyde,0790-7362,,3506,1986
ISEAS Current Economic Affairs Series,B,Cambridge University Press,,,3801,1991
Islamic Economic Studies,B,SyndiGate Media Inc.,1319-1616,,3899,
ISRA International Journal of Islamic Finance,B,Emerald Group Publishing,0128-1976,2289-4365,3502,2009
Issues in Accounting Education,B,American Accounting Association,0739-3172,1558-7983,3501,1983
Issues in Social and Environmental Accounting: An International Journal,B,Sebelas Maret University,,1978-0591,3501,2007
ITE Journal,B,Institute of Transportation Engineers,0162-8178,,3509,
IUP Journal of Accounting Research & Audit Practices,B,IUP Publications,0972-690X,,3501,2009
IUP Journal of Corporate Governance,B,IUP Publications,0972-6853,,3501,2003
IZA Journal of Labor Economics,B,Springer Nature,,2193-8997,3801,2012
Japan and the World Economy,B,Elsevier,0922-1425,,3801,1988
Japan Labor Issues,B,Japan Institute for Labour Policy and Training,2433-3689,,3505,2017
Japanese Economic Review,B,Wiley-Blackwell Publishing,1352-4739,1468-5876,3801,1950
JASSA: The Finsia Journal of Applied Finance,B,Financial Services Institute of Australasia,0313-5934,,3502,1966
Journal of Information Systems and Technology Management,B,University of São Paulo,,1807-1775,4609,2004
Journal Ensayos Sobre Politica Economica (ESPE) / Essays on Economic Policy,B,"Department of Economic Policy Studies, Central Bank of Columbia",0120-4483,,3801,1982
Journal for Advancement of Marketing Education (JAME),B,Marketing Management Association,2326-3296,1537-5137,3506,2001
Journal for Quality and Participation,B,American Society for Quality,1040-9602,1931-4019,3505,1978
Journal for Studies in Economics & Econometrics,B,"University of Stellenbosch, Bureau for Economic Research",0379-6205,,3802,1977
Journal of Aboriginal Economic Development,B,Council for the Advancement of Native Development Officers (CANDO) and Captus Press Inc.,1481-9112,1481-9120,3801,1999
Journal of Academy of Business and Economics,B,International Academy of Business and Economics,1542-8710,2378-8631,3801,2003
Journal of Accountancy,B,Association of International Certified Professional Accountants,0021-8448,1945-0729,3501,1905
Journal of Accounting & Organizational Change,B,Emerald Group Publishing,1832-5912,1839-5473,3501,2005
Journal of Accounting and Economics,B,Elsevier,0165-4101,,3501,1979
Journal of Accounting and Management Information Systems (JAMIS),B,Bucharest University of Economic Studies,1583-4387,2559-6004,3501,2002
Journal of Accounting and Public Policy,B,Elsevier,0278-4254,1873-2070,3501,1982
Journal of Accounting Auditing and Finance,B,Sage Publications,0148-558X,2160-4061,3501,1986
Journal of Accounting Education,B,Elsevier,0748-5751,1873-1996,3501,1983
Journal of Accounting in Emerging Economies,B,Emerald Group Publishing,2042-1168,2042-1176,3501,2011
Journal of Accounting Literature,B,Elsevier,0737-4607,,3501,1981
Journal of Accounting Research,B,Wiley-Blackwell Publishing,0021-8456,1475-679X,3501,1963
"Journal of Accounting, Business and Management",B,Malangkucecwara School of Economics,0216-423X,2622-2167,3501,2005
"Journal of Accounting, Ethics and Public Policy",B,Dumont Institute for Public Policy Research,1089-652X,,3501,1999
Journal of Advanced Transportation,B,Hindawi,0197-6729,2042-3195,3509,1966
Journal of Advertising,B,Taylor & Francis Online,0091-3367,1557-7805,3506,1960
Journal of Advertising Education,B,Sage Publications,1098-0482,,3506,1998
Journal of Advertising Research,B,World Advertising Research Center,0021-8499,1740-1909,3506,1960
Journal of African Business,B,Taylor & Francis Online,1522-8916,1522-9076,3507,2000
Journal of African Development,B,African Finance and Economic Assocation,1060-6076,,3801,1992
Journal of African Economies,B,Oxford University Press,0963-8024,1464-3723,3801,1992
Journal of Agribusiness in Developing and Emerging Economies,B,Emerald Group Publishing,2044-0839,2044-0847,3899,2011
Journal of Agricultural & Food Industrial Organization,B,De Gruyter,1542-0485,2194-5896,3801,2002
Journal of Agricultural and Applied Economics,B,Cambridge University Press,1074-0708,2056-7405,3801,1969
Journal of Agricultural and Resource Economics,B,Western Agricultural Economics Association,1068-5502,2327-8285,3899,1992
Journal of Agricultural Economics,B,Wiley-Blackwell Publishing,0021-857X,1477-9552,3801,1928
"Journal of Agricultural, Biological and Environmental Statistics",B,Springer International Publishing,1085-7117,1537-2693,4905,1996
Journal of Air Law and Commerce,B,Southern Methodist University,0021-8642,,4801,1930
Journal of Air Transport Management,B,Elsevier,0969-6997,1873-2089,3509,1994
Journal of Applied Accounting Research,B,Emerald Group Publishing,0967-5426,1758-8855,3501,1993
Journal of Applied Business and Economics,B,North American Business Press,1499-691X,,3801,2000
Journal of Applied Communication Research,B,Taylor & Francis Online,0090-9882,1479-5752,3507,1973
Journal of Applied Corporate Finance,B,Wiley-Blackwell Publishing,1078-1196,1745-6622,3502,1988
Journal of Applied Econometrics,B,Wiley-Blackwell Publishing,0883-7252,1099-1255,3802,1986
Journal of Applied Economic Sciences,B,ASERS Publishing,1843-6110,2393-5162,3801,2006
Journal of Applied Economics,B,Taylor & Francis Online,1514-0326,1667-6726,3801,1998
"Journal of Applied Finance: theory, practice, education",B,Financial Management Association International (FMA),1534-6668,,3502,1991
Journal of Applied Law and Policy,B,Curtin University,1836-6953,,4801,2008
Journal of Applied Management and Entrepreneurship,B,Nova Southeastern University,1077-1158,1077-1158,3507,1994
Journal of Applied Probability,B,Applied Probability Trust,0021-9002,1475-6072,4905,1964
Journal of Applied Psychology,B,American Psychological Association,0021-9010,1939-1854,3507,1917
Journal of Applied Research in Accounting and Finance,B,The University of Sydney Business School,1834-2582,1834-2590,3501,2006
Journal of Applied Social Psychology,B,Wiley-Blackwell Publishing,0021-9029,1559-1816,3507,1971
Journal of Applied Sport Management,B,Sagamore Publishing,2327-0187,,3504,2009
Journal of Applied Sport Psychology,B,Taylor & Francis Online,1041-3200,1533-1571,3504,1989
Journal of Applied Statistical Science,B,Nova Science Publishers,1067-5817,,4905,1993
Journal of Applied Statistics,B,Taylor & Francis Online,0266-4763,1360-0532,4905,1974
Journal of Arts Management Law and Society,B,Taylor & Francis Online,1063-2921,1930-7799,3504,1969
Journal of Asia Business Studies,B,Emerald Group Publishing Limited,1558-7894,1559-2243,3507,2006
Journal of Asia Entrepreneurship and Sustainability,B,RossiSmith Academic Publishing,1177-4541,1176-8592,3507,
Journal of Asia Pacific Business,B,Taylor & Francis Online,1059-9231,1528-6940,3507,1995
Journal of Asian Business and Economic Studies,B,Emerald Publishing,2515-964X,,3801,2018
Journal of Asian Economics,B,Elsevier,1049-0078,1873-7927,3801,1990
Journal of Australian Political Economy,B,Australian Political Economy Movement,0156-5826,,3899,1977
Journal of Australian Taxation,B,Monash University,1440-0405,,4801,1998
Journal of Banking & Finance,B,Elsevier,0378-4266,1872-6372,3502,1976
Journal of Banking and Finance - Law and Practice,B,Thomson Reuters,1034-3040,,4801,
Journal of Banking Regulation,B,Springer International Publishing,1745-6452,1750-2071,4801,2001
Journal of Behavioral and Experimental Economics,B,Elsevier,2214-8043,,3801,1972
Journal of Behavioral and Experimental Finance,B,Elsevier,2214-6350,,3502,2014
Journal of Behavioral Decision Making,B,Wiley-Blackwell Publishing,0894-3257,1099-0771,3507,1988
Journal of Behavioral Finance,B,Taylor & Francis Online,1542-7560,1542-7579,3502,2000
Journal of Benefit-Cost Analysis,B,Cambridge University Press,2152-2812,,3899,2010
Journal of Bioeconomics,B,Springer International Publishing,1387-6996,1573-6989,3899,1999
Journal of Biopharmaceutical Statistics,B,Taylor & Francis Online,1054-3406,1520-5711,4905,1991
Journal of Brand Management,B,Springer International Publishing,1350-231X,1479-1803,3506,1993
Journal of Business & Economic Statistics,B,Taylor & Francis Online,0735-0015,1537-2707,3802,1983
Journal of Business & Economic Studies,B,Northeast Business & Economics Association (NBEA),1063-343X,2576-3458,3801,1994
Journal of Business & Industrial Marketing,B,Emerald Group Publishing,0885-8624,2052-1189,3506,1986
Journal of Business Analytics,B,Taylor & Francis Online,2573-234X,2573-2358,4609,2018
Journal of Business and Economic Perspectives,B,The University of Tennessee at Martin,1528-5014,,3801,2010
Journal of Business and Economics Research,B,The Clute Institute,1542-4448,2157-8893,3801,2003
Journal of Business and Management,B,"Department of Management Information Systems at College of Commerce, National Chengchi University",1535-668X,,3507,1993
Journal of Business and Psychology,B,Springer International Publishing,0889-3268,1573-353X,3507,1986
Journal of Business and Technical Communication,B,Sage Publications,1050-6519,1552-4574,3507,1987
Journal of Business Chemistry,B,Institute of Business Administration,1613-9615,1613-9623,3507,2004
Journal of Business Cycle Research,B,Springer International Publishing,2509-7962,2509-7970,3801,2004
Journal of Business Economics and Management,B,Taylor & Francis Online,1611-1699,2029-4433,3801,1999
Journal of Business Ethics,B,Springer International Publishing,0167-4544,1573-0697,3507,1982
Journal of Business Finance & Accounting,B,Wiley-Blackwell Publishing,0306-686X,1468-5957,3501,1974
Journal of Business Law,B,Sweet & Maxwell,0021-9460,,4801,1957
Journal of Business Logistics,B,Wiley-Blackwell Publishing,0735-3766,2158-1592,3509,1978
Journal of Business Market Management,B,Springer International Publishing,1864-0753,1864-0761,3506,2007
Journal of Business Research,B,Elsevier,0148-2963,1873-7978,3506,1973
Journal of Business Strategy,B,Emerald Group Publishing,0275-6668,2052-1197,3507,1980
Journal of Business Thought,B,Sri Guru Gobind Singh College of Commerce,2581-8104,2231-1734,3801,2012
Journal of Business Venturing,B,Elsevier,0883-9026,1873-2003,3507,1985
Journal of Business Venturing Insights,B,Elsevier,2352-6734,,3507,2014
Journal of Business-to-Business Marketing,B,Taylor & Francis Online,1051-712X,1547-0628,3506,1993
Journal of Career Assessment,B,Sage Publications,1069-0727,1552-4590,3505,1993
Journal of Career Development,B,Sage Publications,0894-8453,1556-0856,3505,1972
Journal of Cases on Information Technology,B,IGI Global,1548-7717,1548-7725,4609,1999
Journal of Change Management,B,Taylor & Francis Online,1469-7017,1479-1811,3507,2000
Journal of China Tourism Research,B,Taylor & Francis Online,1938-8160,1938-8179,3508,2005
Journal of Chinese Economic and Foreign Trade Studies,B,Emerald Group Publishing,1754-4408,1754-4416,3899,2008
Journal of Chinese Economics and Business Studies,B,Taylor & Francis Online,1476-5284,1476-5292,3801,2003
Journal of Chinese Tax and Policy,B,The University of Sydney,1839-065X,,4801,2011
Journal of Choice Modelling,B,Elsevier,1755-5345,,3803,2008
Journal of Cleaner Production,B,Elsevier,0959-6526,1879-1786,3507,1993
Journal of Co-operative Studies,B,UK Society for Co-operative Studies,0961-5784,,3507,1987
Journal of Commerce and Accounting Research,B,Publishing India Group,2277-2146,2320-4990,3501,2012
Journal of Commodity Markets,B,Elsevier,2405-8513,2405-8505,3502,2016
Journal of Common Market Studies,B,Wiley-Blackwell Publishing,0021-9886,1468-5965,3801,1962
Journal of Communication,B,Oxford University Press,0021-9916,1460-2466,3599,1951
Journal of Communication Management,B,Emerald Group Publishing,1363-254X,1478-0852,3506,1996
Journal of Community Informatics,B,Community Informatics Research Network,,1712-4441,4609,2004
Journal of Comparative Economics,B,Elsevier,0147-5967,1095-7227,3899,1977
Journal of Comparative International Management,B,Array,1481-0468,1718-0864,3507,1998
Journal of Comparative Policy Analysis: research and practice,B,Taylor & Francis Online,1387-6988,1572-5448,3599,1998
Journal of Competition Law and Economics,B,Oxford University Press,1744-6414,1744-6422,3801,2005
Journal of Computational and Graphical Statistics,B,Taylor & Francis Online,1061-8600,1537-2715,4905,1992
Journal of Computational Finance,B,Incisive Risk Information Limited,1460-1559,1755-2850,3502,1997
Journal of Computer and System Sciences,B,Elsevier,0022-0000,1090-2724,4609,1967
Journal of Computer Information Systems,B,Taylor & Francis Online,0887-4417,2380-2057,4609,1960
Journal of Conflict Resolution,B,Sage Publications,0022-0027,1552-8766,3801,1957
Journal of Construction Accounting and Taxation,B,"Warren, Gorham & Lamont, Inc.: Thomson Reuters",1054-3007,,4801,1991
Journal of Construction Engineering and Management,B,American Society of Civil Engineers,0733-9364,1943-7862,3504,1983
Journal of Construction Procurement,B,International Procurement Research Group,1358-9180,,3509,1995
Journal of Constructivist Psychology,B,Taylor & Francis Online,1072-0537,1521-0650,3507,1994
Journal of Consulting and Clinical Psychology,B,American Psychological Association,0022-006X,1939-2117,3507,1937
Journal of Consumer Affairs,B,Wiley-Blackwell Publishing,0022-0078,1745-6606,3506,1967
Journal of Consumer Behaviour,B,Wiley-Blackwell Publishing,1472-0817,1479-1838,3506,2001
Journal of Consumer Marketing,B,Emerald Group Publishing,0736-3761,2052-1200,3506,1984
Journal of Consumer Policy,B,Springer International Publishing,0168-7034,1573-0700,3801,1983
Journal of Consumer Psychology,B,Wiley-Blackwell Publishing,1057-7408,1532-7663,3506,1992
Journal of Consumer Research,B,Oxford University Press,0093-5301,1537-5277,3506,1974
"Journal of Consumer Satisfaction, Dissatisfaction and Complaining Behavior",B,"Consumer Satisfaction, Dissatisfaction, and Complaining Behavior, Inc",0899-8620,,3506,1988
Journal of Contemporary Accounting and Economics,B,Elsevier,1815-5669,,3501,2005
Journal of Contemporary Business Issues,B,Western Illinois University,0194-0430,1553-5347,3507,1988
Journal of Contract Law,B,LexisNexis,1030-7230,,4801,1988
Journal of Convention & Event Tourism,B,Taylor & Francis Online,1547-0148,1547-0156,3508,2004
Journal of Corporate Accounting and Finance,B,Wiley-Blackwell Publishing,1044-8136,1097-0053,3501,1979
Journal of Corporate Finance,B,Elsevier,0929-1199,1872-6313,3502,1994
Journal of Corporate Law Studies,B,Taylor & Francis Online,1473-5970,1757-8426,4801,2001
Journal of Corporate Real Estate,B,Emerald Group Publishing,1463-001X,1479-1048,3504,1998
Journal of Corporation Law,B,University of Iowa College of Law,0360-795X,,4801,1975
Journal of Cost & Management,B,Croatian Accountant,1848-137X,,3501,2015
Journal of Cost Analysis and Parametrics,B,Taylor & Francis Online,1941-658X,2160-4746,3501,1984
Journal of Credit Risk,B,Incisive Risk Information Ltd.,1744-6619,1755-9723,3502,2005
Journal of Cross-Cultural Psychology,B,Sage Publications,0022-0221,1552-5422,3507,1970
Journal of Culinary Science and Technology,B,Taylor & Francis Online,1542-8052,1542-8044,3504,1994
Journal of Cultural Economics,B,Springer International Publishing,0885-2545,1573-6997,3801,1977
Journal of Cultural Heritage Management and Sustainable Development,B,Emerald Group Publishing,2044-1266,2044-1274,3508,2011
Journal of Current Issues and Research in Advertising,B,Taylor & Francis Online,1064-1734,2164-7313,3506,1978
Journal of Customer Behavior,B,Westburn Publishers Ltd,1475-3928,1477-6421,3506,2002
Journal of Database Management,B,IGI Global,1063-8016,1533-8010,4609,1990
Journal of Database Marketing & Customer Strategy Management,B,Palgrave Macmillan,1741-2439,1741-2447,3506,2000
Journal of Decision Systems,B,Taylor & Francis Online,1246-0125,2116-7052,4609,1992
